id,data,hora,contribuicao
37417,17-03-2025,19:00,Criei grupo do whatsapp
37417,19-03-2025,18:52,Sugerir ideia de forum ao inves de tarefa
37417,19-03-2025,19:05,Sugerir definição de ciência como conhecimento
37417,19-03-2025,19:16, Compiladores como disciplina que nao usa dados
06190,19-03-2025,19:00, Fiquei responsável pelo livro texto da disciplina, organizando as cópias.
06190,24-03-2025,19:00, Sugestão de conceito de Pesquisa Operacional.
06190,24-03-2025,19:00, Lembretes no grupo da disciplina sobre atividade requisitada na aula + preenchimento de planílha de contribuições.
